<xs:schema attributeFormDefault="unqualified" elementFormDefault="qualified" xmlns:xs="http://www.w3.org/2001/XMLSchema">
  <xs:element name="emails">
    <xs:complexType>
      <xs:sequence>
        <xs:element name="email" maxOccurs="unbounded" minOccurs="0">
          <xs:complexType>
            <xs:sequence>
              <xs:element name="head">
                <xs:complexType>
                  <xs:sequence>
                    <xs:element type="xs:string" name="date"/>
                    <xs:element type="xs:string" name="from"/>
                    <xs:element type="xs:string" name="to"/>
                    <xs:element name="copy" maxOccurs="unbounded" minOccurs="0">
                      <xs:complexType>
                        <xs:simpleContent>
                          <xs:extension base="xs:string">
                            <xs:attribute type="xs:string" name="type" use="optional"/>
                          </xs:extension>
                        </xs:simpleContent>
                      </xs:complexType>
                    </xs:element>
                    <xs:element type="xs:string" name="subject" minOccurs="0"/>
                  </xs:sequence>
                </xs:complexType>
              </xs:element>
              <xs:element name="body">
                <xs:complexType>
                  <xs:sequence>
                    <xs:element type="xs:string" name="message"/>
                  </xs:sequence>
                </xs:complexType>
              </xs:element>
              <xs:element name="attachement" maxOccurs="unbounded" minOccurs="0">
                <xs:complexType>
                  <xs:simpleContent>
                    <xs:extension base="xs:string">
                      <xs:attribute type="xs:string" name="file" use="optional"/>
                    </xs:extension>
                  </xs:simpleContent>
                </xs:complexType>
              </xs:element>
            </xs:sequence>
          </xs:complexType>
        </xs:element>
      </xs:sequence>
    </xs:complexType>
  </xs:element>
</xs:schema>